<?xml version="1.0" encoding="UTF-8"?>
<!DOCTYPE Map SYSTEM "Byte2unicode.dtd">
<Map>
  <Code Byte="16#A1#">16#0401#</Code>
  <Code Byte="16#A2#">16#0402#</Code>
  <Code Byte="16#A3#">16#0403#</Code>
  <Code Byte="16#A4#">16#0404#</Code>
  <Code Byte="16#A5#">16#0405#</Code>
  <Code Byte="16#A6#">16#0406#</Code>
  <Code Byte="16#A7#">16#0407#</Code>
  <Code Byte="16#A8#">16#0408#</Code>
  <Code Byte="16#A9#">16#0409#</Code>
  <Code Byte="16#AA#">16#040A#</Code>
  <Code Byte="16#AB#">16#040B#</Code>
  <Code Byte="16#AC#">16#040C#</Code>
  <Code Byte="16#AE#">16#040E#</Code>
  <Code Byte="16#AF#">16#040F#</Code>
  <Code Byte="16#B0#">16#0410#</Code>
  <Code Byte="16#B1#">16#0411#</Code>
  <Code Byte="16#B2#">16#0412#</Code>
  <Code Byte="16#B3#">16#0413#</Code>
  <Code Byte="16#B4#">16#0414#</Code>
  <Code Byte="16#B5#">16#0415#</Code>
  <Code Byte="16#B6#">16#0416#</Code>
  <Code Byte="16#B7#">16#0417#</Code>
  <Code Byte="16#B8#">16#0418#</Code>
  <Code Byte="16#B9#">16#0419#</Code>
  <Code Byte="16#BA#">16#041A#</Code>
  <Code Byte="16#BB#">16#041B#</Code>
  <Code Byte="16#BC#">16#041C#</Code>
  <Code Byte="16#BD#">16#041D#</Code>
  <Code Byte="16#BE#">16#041E#</Code>
  <Code Byte="16#BF#">16#041F#</Code>
  <Code Byte="16#C0#">16#0420#</Code>
  <Code Byte="16#C1#">16#0421#</Code>
  <Code Byte="16#C2#">16#0422#</Code>
  <Code Byte="16#C3#">16#0423#</Code>
  <Code Byte="16#C4#">16#0424#</Code>
  <Code Byte="16#C5#">16#0425#</Code>
  <Code Byte="16#C6#">16#0426#</Code>
  <Code Byte="16#C7#">16#0427#</Code>
  <Code Byte="16#C8#">16#0428#</Code>
  <Code Byte="16#C9#">16#0429#</Code>
  <Code Byte="16#CA#">16#042A#</Code>
  <Code Byte="16#CB#">16#042B#</Code>
  <Code Byte="16#CC#">16#042C#</Code>
  <Code Byte="16#CD#">16#042D#</Code>
  <Code Byte="16#CE#">16#042E#</Code>
  <Code Byte="16#CF#">16#042F#</Code>
  <Code Byte="16#D0#">16#0430#</Code>
  <Code Byte="16#D1#">16#0431#</Code>
  <Code Byte="16#D2#">16#0432#</Code>
  <Code Byte="16#D3#">16#0433#</Code>
  <Code Byte="16#D4#">16#0434#</Code>
  <Code Byte="16#D5#">16#0435#</Code>
  <Code Byte="16#D6#">16#0436#</Code>
  <Code Byte="16#D7#">16#0437#</Code>
  <Code Byte="16#D8#">16#0438#</Code>
  <Code Byte="16#D9#">16#0439#</Code>
  <Code Byte="16#DA#">16#043A#</Code>
  <Code Byte="16#DB#">16#043B#</Code>
  <Code Byte="16#DC#">16#043C#</Code>
  <Code Byte="16#DD#">16#043D#</Code>
  <Code Byte="16#DE#">16#043E#</Code>
  <Code Byte="16#DF#">16#043F#</Code>
  <Code Byte="16#E0#">16#0440#</Code>
  <Code Byte="16#E1#">16#0441#</Code>
  <Code Byte="16#E2#">16#0442#</Code>
  <Code Byte="16#E3#">16#0443#</Code>
  <Code Byte="16#E4#">16#0444#</Code>
  <Code Byte="16#E5#">16#0445#</Code>
  <Code Byte="16#E6#">16#0446#</Code>
  <Code Byte="16#E7#">16#0447#</Code>
  <Code Byte="16#E8#">16#0448#</Code>
  <Code Byte="16#E9#">16#0449#</Code>
  <Code Byte="16#EA#">16#044A#</Code>
  <Code Byte="16#EB#">16#044B#</Code>
  <Code Byte="16#EC#">16#044C#</Code>
  <Code Byte="16#ED#">16#044D#</Code>
  <Code Byte="16#EE#">16#044E#</Code>
  <Code Byte="16#EF#">16#044F#</Code>
  <Code Byte="16#F0#">16#2116#</Code>
  <Code Byte="16#F1#">16#0451#</Code>
  <Code Byte="16#F2#">16#0452#</Code>
  <Code Byte="16#F3#">16#0453#</Code>
  <Code Byte="16#F4#">16#0454#</Code>
  <Code Byte="16#F5#">16#0455#</Code>
  <Code Byte="16#F6#">16#0456#</Code>
  <Code Byte="16#F7#">16#0457#</Code>
  <Code Byte="16#F8#">16#0458#</Code>
  <Code Byte="16#F9#">16#0459#</Code>
  <Code Byte="16#FA#">16#045A#</Code>
  <Code Byte="16#FB#">16#045B#</Code>
  <Code Byte="16#FC#">16#045C#</Code>
  <Code Byte="16#FD#">16#00A7#</Code>
  <Code Byte="16#FE#">16#045E#</Code>
  <Code Byte="16#FF#">16#045F#</Code>
</Map>

