<?xml version="1.0" encoding="UTF-8"?>
<!DOCTYPE Map SYSTEM "byte2unicode.dtd">
<Map>
  <Code Byte="16#00#">16#0000#</Code>
  <Code Byte="16#01#">16#0001#</Code>
  <Code Byte="16#02#">16#0002#</Code>
  <Code Byte="16#03#">16#0003#</Code>
  <Code Byte="16#04#">16#0004#</Code>
  <Code Byte="16#05#">16#0005#</Code>
  <Code Byte="16#06#">16#0006#</Code>
  <Code Byte="16#07#">16#0007#</Code>
  <Code Byte="16#08#">16#0008#</Code>
  <Code Byte="16#09#">16#0009#</Code>
  <Code Byte="16#0A#">16#000A#</Code>
  <Code Byte="16#0B#">16#000B#</Code>
  <Code Byte="16#0C#">16#000C#</Code>
  <Code Byte="16#0D#">16#000D#</Code>
  <Code Byte="16#0E#">16#000E#</Code>
  <Code Byte="16#0F#">16#000F#</Code>
  <Code Byte="16#10#">16#0010#</Code>
  <Code Byte="16#11#">16#0011#</Code>
  <Code Byte="16#12#">16#0012#</Code>
  <Code Byte="16#13#">16#0013#</Code>
  <Code Byte="16#14#">16#0014#</Code>
  <Code Byte="16#15#">16#0015#</Code>
  <Code Byte="16#16#">16#0016#</Code>
  <Code Byte="16#17#">16#0017#</Code>
  <Code Byte="16#18#">16#0018#</Code>
  <Code Byte="16#19#">16#0019#</Code>
  <Code Byte="16#1A#">16#001A#</Code>
  <Code Byte="16#1B#">16#001B#</Code>
  <Code Byte="16#1C#">16#001C#</Code>
  <Code Byte="16#1D#">16#001D#</Code>
  <Code Byte="16#1E#">16#001E#</Code>
  <Code Byte="16#1F#">16#001F#</Code>
  <Code Byte="16#20#">16#0020#</Code>
  <Code Byte="16#21#">16#0021#</Code>
  <Code Byte="16#22#">16#0022#</Code>
  <Code Byte="16#23#">16#0023#</Code>
  <Code Byte="16#24#">16#0024#</Code>
  <Code Byte="16#25#">16#0025#</Code>
  <Code Byte="16#26#">16#0026#</Code>
  <Code Byte="16#27#">16#0027#</Code>
  <Code Byte="16#28#">16#0028#</Code>
  <Code Byte="16#29#">16#0029#</Code>
  <Code Byte="16#2A#">16#002A#</Code>
  <Code Byte="16#2B#">16#002B#</Code>
  <Code Byte="16#2C#">16#002C#</Code>
  <Code Byte="16#2D#">16#002D#</Code>
  <Code Byte="16#2E#">16#002E#</Code>
  <Code Byte="16#2F#">16#002F#</Code>
  <Code Byte="16#30#">16#0030#</Code>
  <Code Byte="16#31#">16#0031#</Code>
  <Code Byte="16#32#">16#0032#</Code>
  <Code Byte="16#33#">16#0033#</Code>
  <Code Byte="16#34#">16#0034#</Code>
  <Code Byte="16#35#">16#0035#</Code>
  <Code Byte="16#36#">16#0036#</Code>
  <Code Byte="16#37#">16#0037#</Code>
  <Code Byte="16#38#">16#0038#</Code>
  <Code Byte="16#39#">16#0039#</Code>
  <Code Byte="16#3A#">16#003A#</Code>
  <Code Byte="16#3B#">16#003B#</Code>
  <Code Byte="16#3C#">16#003C#</Code>
  <Code Byte="16#3D#">16#003D#</Code>
  <Code Byte="16#3E#">16#003E#</Code>
  <Code Byte="16#3F#">16#003F#</Code>
  <Code Byte="16#40#">16#0040#</Code>
  <Code Byte="16#41#">16#0041#</Code>
  <Code Byte="16#42#">16#0042#</Code>
  <Code Byte="16#43#">16#0043#</Code>
  <Code Byte="16#44#">16#0044#</Code>
  <Code Byte="16#45#">16#0045#</Code>
  <Code Byte="16#46#">16#0046#</Code>
  <Code Byte="16#47#">16#0047#</Code>
  <Code Byte="16#48#">16#0048#</Code>
  <Code Byte="16#49#">16#0049#</Code>
  <Code Byte="16#4A#">16#004A#</Code>
  <Code Byte="16#4B#">16#004B#</Code>
  <Code Byte="16#4C#">16#004C#</Code>
  <Code Byte="16#4D#">16#004D#</Code>
  <Code Byte="16#4E#">16#004E#</Code>
  <Code Byte="16#4F#">16#004F#</Code>
  <Code Byte="16#50#">16#0050#</Code>
  <Code Byte="16#51#">16#0051#</Code>
  <Code Byte="16#52#">16#0052#</Code>
  <Code Byte="16#53#">16#0053#</Code>
  <Code Byte="16#54#">16#0054#</Code>
  <Code Byte="16#55#">16#0055#</Code>
  <Code Byte="16#56#">16#0056#</Code>
  <Code Byte="16#57#">16#0057#</Code>
  <Code Byte="16#58#">16#0058#</Code>
  <Code Byte="16#59#">16#0059#</Code>
  <Code Byte="16#5A#">16#005A#</Code>
  <Code Byte="16#5B#">16#005B#</Code>
  <Code Byte="16#5C#">16#005C#</Code>
  <Code Byte="16#5D#">16#005D#</Code>
  <Code Byte="16#5E#">16#005E#</Code>
  <Code Byte="16#5F#">16#005F#</Code>
  <Code Byte="16#60#">16#0060#</Code>
  <Code Byte="16#61#">16#0061#</Code>
  <Code Byte="16#62#">16#0062#</Code>
  <Code Byte="16#63#">16#0063#</Code>
  <Code Byte="16#64#">16#0064#</Code>
  <Code Byte="16#65#">16#0065#</Code>
  <Code Byte="16#66#">16#0066#</Code>
  <Code Byte="16#67#">16#0067#</Code>
  <Code Byte="16#68#">16#0068#</Code>
  <Code Byte="16#69#">16#0069#</Code>
  <Code Byte="16#6A#">16#006A#</Code>
  <Code Byte="16#6B#">16#006B#</Code>
  <Code Byte="16#6C#">16#006C#</Code>
  <Code Byte="16#6D#">16#006D#</Code>
  <Code Byte="16#6E#">16#006E#</Code>
  <Code Byte="16#6F#">16#006F#</Code>
  <Code Byte="16#70#">16#0070#</Code>
  <Code Byte="16#71#">16#0071#</Code>
  <Code Byte="16#72#">16#0072#</Code>
  <Code Byte="16#73#">16#0073#</Code>
  <Code Byte="16#74#">16#0074#</Code>
  <Code Byte="16#75#">16#0075#</Code>
  <Code Byte="16#76#">16#0076#</Code>
  <Code Byte="16#77#">16#0077#</Code>
  <Code Byte="16#78#">16#0078#</Code>
  <Code Byte="16#79#">16#0079#</Code>
  <Code Byte="16#7A#">16#007A#</Code>
  <Code Byte="16#7B#">16#007B#</Code>
  <Code Byte="16#7C#">16#007C#</Code>
  <Code Byte="16#7D#">16#007D#</Code>
  <Code Byte="16#7E#">16#007E#</Code>
  <Code Byte="16#7F#">16#007F#</Code>
  <Code Byte="16#80#">16#0080#</Code>
  <Code Byte="16#81#">16#0081#</Code>
  <Code Byte="16#82#">16#0082#</Code>
  <Code Byte="16#83#">16#0083#</Code>
  <Code Byte="16#84#">16#0084#</Code>
  <Code Byte="16#85#">16#0085#</Code>
  <Code Byte="16#86#">16#0086#</Code>
  <Code Byte="16#87#">16#0087#</Code>
  <Code Byte="16#88#">16#0088#</Code>
  <Code Byte="16#89#">16#0089#</Code>
  <Code Byte="16#8A#">16#008A#</Code>
  <Code Byte="16#8B#">16#008B#</Code>
  <Code Byte="16#8C#">16#008C#</Code>
  <Code Byte="16#8D#">16#008D#</Code>
  <Code Byte="16#8E#">16#008E#</Code>
  <Code Byte="16#8F#">16#008F#</Code>
  <Code Byte="16#90#">16#0090#</Code>
  <Code Byte="16#91#">16#0091#</Code>
  <Code Byte="16#92#">16#0092#</Code>
  <Code Byte="16#93#">16#0093#</Code>
  <Code Byte="16#94#">16#0094#</Code>
  <Code Byte="16#95#">16#0095#</Code>
  <Code Byte="16#96#">16#0096#</Code>
  <Code Byte="16#97#">16#0097#</Code>
  <Code Byte="16#98#">16#0098#</Code>
  <Code Byte="16#99#">16#0099#</Code>
  <Code Byte="16#9A#">16#009A#</Code>
  <Code Byte="16#9B#">16#009B#</Code>
  <Code Byte="16#9C#">16#009C#</Code>
  <Code Byte="16#9D#">16#009D#</Code>
  <Code Byte="16#9E#">16#009E#</Code>
  <Code Byte="16#9F#">16#009F#</Code>
  <Code Byte="16#A0#">16#00A0#</Code>
  <Code Byte="16#A1#">16#2018#</Code>
  <Code Byte="16#A2#">16#2019#</Code>
  <Code Byte="16#A3#">16#00A3#</Code>
  <Code Byte="16#A4#">16#20AC#</Code>
  <Code Byte="16#A5#">16#20AF#</Code>
  <Code Byte="16#A6#">16#00A6#</Code>
  <Code Byte="16#A7#">16#00A7#</Code>
  <Code Byte="16#A8#">16#00A8#</Code>
  <Code Byte="16#A9#">16#00A9#</Code>
  <Code Byte="16#AA#">16#037A#</Code>
  <Code Byte="16#AB#">16#00AB#</Code>
  <Code Byte="16#AC#">16#00AC#</Code>
  <Code Byte="16#AD#">16#00AD#</Code>
  <Code Byte="16#AF#">16#2015#</Code>
  <Code Byte="16#B0#">16#00B0#</Code>
  <Code Byte="16#B1#">16#00B1#</Code>
  <Code Byte="16#B2#">16#00B2#</Code>
  <Code Byte="16#B3#">16#00B3#</Code>
  <Code Byte="16#B4#">16#0384#</Code>
  <Code Byte="16#B5#">16#0385#</Code>
  <Code Byte="16#B6#">16#0386#</Code>
  <Code Byte="16#B7#">16#00B7#</Code>
  <Code Byte="16#B8#">16#0388#</Code>
  <Code Byte="16#B9#">16#0389#</Code>
  <Code Byte="16#BA#">16#038A#</Code>
  <Code Byte="16#BB#">16#00BB#</Code>
  <Code Byte="16#BC#">16#038C#</Code>
  <Code Byte="16#BD#">16#00BD#</Code>
  <Code Byte="16#BE#">16#038E#</Code>
  <Code Byte="16#BF#">16#038F#</Code>
  <Code Byte="16#C0#">16#0390#</Code>
  <Code Byte="16#C1#">16#0391#</Code>
  <Code Byte="16#C2#">16#0392#</Code>
  <Code Byte="16#C3#">16#0393#</Code>
  <Code Byte="16#C4#">16#0394#</Code>
  <Code Byte="16#C5#">16#0395#</Code>
  <Code Byte="16#C6#">16#0396#</Code>
  <Code Byte="16#C7#">16#0397#</Code>
  <Code Byte="16#C8#">16#0398#</Code>
  <Code Byte="16#C9#">16#0399#</Code>
  <Code Byte="16#CA#">16#039A#</Code>
  <Code Byte="16#CB#">16#039B#</Code>
  <Code Byte="16#CC#">16#039C#</Code>
  <Code Byte="16#CD#">16#039D#</Code>
  <Code Byte="16#CE#">16#039E#</Code>
  <Code Byte="16#CF#">16#039F#</Code>
  <Code Byte="16#D0#">16#03A0#</Code>
  <Code Byte="16#D1#">16#03A1#</Code>
  <Code Byte="16#D3#">16#03A3#</Code>
  <Code Byte="16#D4#">16#03A4#</Code>
  <Code Byte="16#D5#">16#03A5#</Code>
  <Code Byte="16#D6#">16#03A6#</Code>
  <Code Byte="16#D7#">16#03A7#</Code>
  <Code Byte="16#D8#">16#03A8#</Code>
  <Code Byte="16#D9#">16#03A9#</Code>
  <Code Byte="16#DA#">16#03AA#</Code>
  <Code Byte="16#DB#">16#03AB#</Code>
  <Code Byte="16#DC#">16#03AC#</Code>
  <Code Byte="16#DD#">16#03AD#</Code>
  <Code Byte="16#DE#">16#03AE#</Code>
  <Code Byte="16#DF#">16#03AF#</Code>
  <Code Byte="16#E0#">16#03B0#</Code>
  <Code Byte="16#E1#">16#03B1#</Code>
  <Code Byte="16#E2#">16#03B2#</Code>
  <Code Byte="16#E3#">16#03B3#</Code>
  <Code Byte="16#E4#">16#03B4#</Code>
  <Code Byte="16#E5#">16#03B5#</Code>
  <Code Byte="16#E6#">16#03B6#</Code>
  <Code Byte="16#E7#">16#03B7#</Code>
  <Code Byte="16#E8#">16#03B8#</Code>
  <Code Byte="16#E9#">16#03B9#</Code>
  <Code Byte="16#EA#">16#03BA#</Code>
  <Code Byte="16#EB#">16#03BB#</Code>
  <Code Byte="16#EC#">16#03BC#</Code>
  <Code Byte="16#ED#">16#03BD#</Code>
  <Code Byte="16#EE#">16#03BE#</Code>
  <Code Byte="16#EF#">16#03BF#</Code>
  <Code Byte="16#F0#">16#03C0#</Code>
  <Code Byte="16#F1#">16#03C1#</Code>
  <Code Byte="16#F2#">16#03C2#</Code>
  <Code Byte="16#F3#">16#03C3#</Code>
  <Code Byte="16#F4#">16#03C4#</Code>
  <Code Byte="16#F5#">16#03C5#</Code>
  <Code Byte="16#F6#">16#03C6#</Code>
  <Code Byte="16#F7#">16#03C7#</Code>
  <Code Byte="16#F8#">16#03C8#</Code>
  <Code Byte="16#F9#">16#03C9#</Code>
  <Code Byte="16#FA#">16#03CA#</Code>
  <Code Byte="16#FB#">16#03CB#</Code>
  <Code Byte="16#FC#">16#03CC#</Code>
  <Code Byte="16#FD#">16#03CD#</Code>
  <Code Byte="16#FE#">16#03CE#</Code>
</Map>

