<?xml version="1.0" encoding="UTF-8"?>
<!DOCTYPE Map SYSTEM "Byte2unicode.dtd">
<Map>
  <Code Byte="16#A1#">16#0126#</Code>
  <Code Byte="16#A2#">16#02D8#</Code>
  <Code Byte="16#A6#">16#0124#</Code>
  <Code Byte="16#A9#">16#0130#</Code>
  <Code Byte="16#AA#">16#015E#</Code>
  <Code Byte="16#AB#">16#011E#</Code>
  <Code Byte="16#AC#">16#0134#</Code>
  <Code Byte="16#AF#">16#017B#</Code>
  <Code Byte="16#B1#">16#0127#</Code>
  <Code Byte="16#B6#">16#0125#</Code>
  <Code Byte="16#B9#">16#0131#</Code>
  <Code Byte="16#BA#">16#015F#</Code>
  <Code Byte="16#BB#">16#011F#</Code>
  <Code Byte="16#BC#">16#0135#</Code>
  <Code Byte="16#BF#">16#017C#</Code>
  <Code Byte="16#C5#">16#010A#</Code>
  <Code Byte="16#C6#">16#0108#</Code>
  <Code Byte="16#D5#">16#0120#</Code>
  <Code Byte="16#D8#">16#011C#</Code>
  <Code Byte="16#DD#">16#016C#</Code>
  <Code Byte="16#DE#">16#015C#</Code>
  <Code Byte="16#E5#">16#010B#</Code>
  <Code Byte="16#E6#">16#0109#</Code>
  <Code Byte="16#F5#">16#0121#</Code>
  <Code Byte="16#F8#">16#011D#</Code>
  <Code Byte="16#FD#">16#016D#</Code>
  <Code Byte="16#FE#">16#015D#</Code>
  <Code Byte="16#FF#">16#02D9#</Code>
</Map>

