<?xml version="1.0" encoding="UTF-8"?>
<!DOCTYPE Map SYSTEM "Byte2unicode.dtd">
<Map>
  <Code Byte="16#AA#">16#00D7#</Code>
  <Code Byte="16#BA#">16#00F7#</Code>
  <Code Byte="16#DF#">16#2017#</Code>
  <Code Byte="16#E0#">16#05D0#</Code>
  <Code Byte="16#E1#">16#05D1#</Code>
  <Code Byte="16#E2#">16#05D2#</Code>
  <Code Byte="16#E3#">16#05D3#</Code>
  <Code Byte="16#E4#">16#05D4#</Code>
  <Code Byte="16#E5#">16#05D5#</Code>
  <Code Byte="16#E6#">16#05D6#</Code>
  <Code Byte="16#E7#">16#05D7#</Code>
  <Code Byte="16#E8#">16#05D8#</Code>
  <Code Byte="16#E9#">16#05D9#</Code>
  <Code Byte="16#EA#">16#05DA#</Code>
  <Code Byte="16#EB#">16#05DB#</Code>
  <Code Byte="16#EC#">16#05DC#</Code>
  <Code Byte="16#ED#">16#05DD#</Code>
  <Code Byte="16#EE#">16#05DE#</Code>
  <Code Byte="16#EF#">16#05DF#</Code>
  <Code Byte="16#F0#">16#05E0#</Code>
  <Code Byte="16#F1#">16#05E1#</Code>
  <Code Byte="16#F2#">16#05E2#</Code>
  <Code Byte="16#F3#">16#05E3#</Code>
  <Code Byte="16#F4#">16#05E4#</Code>
  <Code Byte="16#F5#">16#05E5#</Code>
  <Code Byte="16#F6#">16#05E6#</Code>
  <Code Byte="16#F7#">16#05E7#</Code>
  <Code Byte="16#F8#">16#05E8#</Code>
  <Code Byte="16#F9#">16#05E9#</Code>
  <Code Byte="16#FA#">16#05EA#</Code>
  <Code Byte="16#FD#">16#200E#</Code>
  <Code Byte="16#FE#">16#200F#</Code>
</Map>

