<?xml version="1.0" encoding="UTF-8"?>
<!DOCTYPE Map SYSTEM "Byte2unicode.dtd">
<Map>
  <Code Byte="16#A1#">16#0104#</Code>
  <Code Byte="16#A2#">16#0105#</Code>
  <Code Byte="16#A3#">16#0141#</Code>
  <Code Byte="16#A4#">16#20AC#</Code>
  <Code Byte="16#A5#">16#201E#</Code>
  <Code Byte="16#A6#">16#0160#</Code>
  <Code Byte="16#A8#">16#0161#</Code>
  <Code Byte="16#AA#">16#0218#</Code>
  <Code Byte="16#AC#">16#0179#</Code>
  <Code Byte="16#AE#">16#017A#</Code>
  <Code Byte="16#AF#">16#017B#</Code>
  <Code Byte="16#B2#">16#010C#</Code>
  <Code Byte="16#B3#">16#0142#</Code>
  <Code Byte="16#B4#">16#017D#</Code>
  <Code Byte="16#B5#">16#201D#</Code>
  <Code Byte="16#B8#">16#017E#</Code>
  <Code Byte="16#B9#">16#010D#</Code>
  <Code Byte="16#BA#">16#0219#</Code>
  <Code Byte="16#BC#">16#0152#</Code>
  <Code Byte="16#BD#">16#0153#</Code>
  <Code Byte="16#BE#">16#0178#</Code>
  <Code Byte="16#BF#">16#017C#</Code>
  <Code Byte="16#C3#">16#0102#</Code>
  <Code Byte="16#C5#">16#0106#</Code>
  <Code Byte="16#D0#">16#0110#</Code>
  <Code Byte="16#D1#">16#0143#</Code>
  <Code Byte="16#D5#">16#0150#</Code>
  <Code Byte="16#D7#">16#015A#</Code>
  <Code Byte="16#D8#">16#0170#</Code>
  <Code Byte="16#DD#">16#0118#</Code>
  <Code Byte="16#DE#">16#021A#</Code>
  <Code Byte="16#E3#">16#0103#</Code>
  <Code Byte="16#E5#">16#0107#</Code>
  <Code Byte="16#F0#">16#0111#</Code>
  <Code Byte="16#F1#">16#0144#</Code>
  <Code Byte="16#F5#">16#0151#</Code>
  <Code Byte="16#F7#">16#015B#</Code>
  <Code Byte="16#F8#">16#0171#</Code>
  <Code Byte="16#FD#">16#0119#</Code>
  <Code Byte="16#FE#">16#021B#</Code>
</Map>

