<?xml version="1.0" encoding="UTF-8"?>
<!DOCTYPE Map SYSTEM "Byte2unicode.dtd">
<Map>
  <Code Byte="16#A1#">16#201D#</Code>
  <Code Byte="16#A5#">16#201E#</Code>
  <Code Byte="16#A8#">16#00D8#</Code>
  <Code Byte="16#AA#">16#0156#</Code>
  <Code Byte="16#AF#">16#00C6#</Code>
  <Code Byte="16#B4#">16#201C#</Code>
  <Code Byte="16#B8#">16#00F8#</Code>
  <Code Byte="16#BA#">16#0157#</Code>
  <Code Byte="16#BF#">16#00E6#</Code>
  <Code Byte="16#C0#">16#0104#</Code>
  <Code Byte="16#C1#">16#012E#</Code>
  <Code Byte="16#C2#">16#0100#</Code>
  <Code Byte="16#C3#">16#0106#</Code>
  <Code Byte="16#C6#">16#0118#</Code>
  <Code Byte="16#C7#">16#0112#</Code>
  <Code Byte="16#C8#">16#010C#</Code>
  <Code Byte="16#CA#">16#0179#</Code>
  <Code Byte="16#CB#">16#0116#</Code>
  <Code Byte="16#CC#">16#0122#</Code>
  <Code Byte="16#CD#">16#0136#</Code>
  <Code Byte="16#CE#">16#012A#</Code>
  <Code Byte="16#CF#">16#013B#</Code>
  <Code Byte="16#D0#">16#0160#</Code>
  <Code Byte="16#D1#">16#0143#</Code>
  <Code Byte="16#D2#">16#0145#</Code>
  <Code Byte="16#D4#">16#014C#</Code>
  <Code Byte="16#D8#">16#0172#</Code>
  <Code Byte="16#D9#">16#0141#</Code>
  <Code Byte="16#DA#">16#015A#</Code>
  <Code Byte="16#DB#">16#016A#</Code>
  <Code Byte="16#DD#">16#017B#</Code>
  <Code Byte="16#DE#">16#017D#</Code>
  <Code Byte="16#E0#">16#0105#</Code>
  <Code Byte="16#E1#">16#012F#</Code>
  <Code Byte="16#E2#">16#0101#</Code>
  <Code Byte="16#E3#">16#0107#</Code>
  <Code Byte="16#E6#">16#0119#</Code>
  <Code Byte="16#E7#">16#0113#</Code>
  <Code Byte="16#E8#">16#010D#</Code>
  <Code Byte="16#EA#">16#017A#</Code>
  <Code Byte="16#EB#">16#0117#</Code>
  <Code Byte="16#EC#">16#0123#</Code>
  <Code Byte="16#ED#">16#0137#</Code>
  <Code Byte="16#EE#">16#012B#</Code>
  <Code Byte="16#EF#">16#013C#</Code>
  <Code Byte="16#F0#">16#0161#</Code>
  <Code Byte="16#F1#">16#0144#</Code>
  <Code Byte="16#F2#">16#0146#</Code>
  <Code Byte="16#F4#">16#014D#</Code>
  <Code Byte="16#F8#">16#0173#</Code>
  <Code Byte="16#F9#">16#0142#</Code>
  <Code Byte="16#FA#">16#015B#</Code>
  <Code Byte="16#FB#">16#016B#</Code>
  <Code Byte="16#FD#">16#017C#</Code>
  <Code Byte="16#FE#">16#017E#</Code>
  <Code Byte="16#FF#">16#2019#</Code>
</Map>

