<?xml version="1.0" encoding="UTF-8"?>
<!DOCTYPE Map SYSTEM "Byte2unicode.dtd">
<Map>
  <Code Byte="16#A1#">16#0E01#</Code>
  <Code Byte="16#A2#">16#0E02#</Code>
  <Code Byte="16#A3#">16#0E03#</Code>
  <Code Byte="16#A4#">16#0E04#</Code>
  <Code Byte="16#A5#">16#0E05#</Code>
  <Code Byte="16#A6#">16#0E06#</Code>
  <Code Byte="16#A7#">16#0E07#</Code>
  <Code Byte="16#A8#">16#0E08#</Code>
  <Code Byte="16#A9#">16#0E09#</Code>
  <Code Byte="16#AA#">16#0E0A#</Code>
  <Code Byte="16#AB#">16#0E0B#</Code>
  <Code Byte="16#AC#">16#0E0C#</Code>
  <Code Byte="16#AD#">16#0E0D#</Code>
  <Code Byte="16#AE#">16#0E0E#</Code>
  <Code Byte="16#AF#">16#0E0F#</Code>
  <Code Byte="16#B0#">16#0E10#</Code>
  <Code Byte="16#B1#">16#0E11#</Code>
  <Code Byte="16#B2#">16#0E12#</Code>
  <Code Byte="16#B3#">16#0E13#</Code>
  <Code Byte="16#B4#">16#0E14#</Code>
  <Code Byte="16#B5#">16#0E15#</Code>
  <Code Byte="16#B6#">16#0E16#</Code>
  <Code Byte="16#B7#">16#0E17#</Code>
  <Code Byte="16#B8#">16#0E18#</Code>
  <Code Byte="16#B9#">16#0E19#</Code>
  <Code Byte="16#BA#">16#0E1A#</Code>
  <Code Byte="16#BB#">16#0E1B#</Code>
  <Code Byte="16#BC#">16#0E1C#</Code>
  <Code Byte="16#BD#">16#0E1D#</Code>
  <Code Byte="16#BE#">16#0E1E#</Code>
  <Code Byte="16#BF#">16#0E1F#</Code>
  <Code Byte="16#C0#">16#0E20#</Code>
  <Code Byte="16#C1#">16#0E21#</Code>
  <Code Byte="16#C2#">16#0E22#</Code>
  <Code Byte="16#C3#">16#0E23#</Code>
  <Code Byte="16#C4#">16#0E24#</Code>
  <Code Byte="16#C5#">16#0E25#</Code>
  <Code Byte="16#C6#">16#0E26#</Code>
  <Code Byte="16#C7#">16#0E27#</Code>
  <Code Byte="16#C8#">16#0E28#</Code>
  <Code Byte="16#C9#">16#0E29#</Code>
  <Code Byte="16#CA#">16#0E2A#</Code>
  <Code Byte="16#CB#">16#0E2B#</Code>
  <Code Byte="16#CC#">16#0E2C#</Code>
  <Code Byte="16#CD#">16#0E2D#</Code>
  <Code Byte="16#CE#">16#0E2E#</Code>
  <Code Byte="16#CF#">16#0E2F#</Code>
  <Code Byte="16#D0#">16#0E30#</Code>
  <Code Byte="16#D1#">16#0E31#</Code>
  <Code Byte="16#D2#">16#0E32#</Code>
  <Code Byte="16#D3#">16#0E33#</Code>
  <Code Byte="16#D4#">16#0E34#</Code>
  <Code Byte="16#D5#">16#0E35#</Code>
  <Code Byte="16#D6#">16#0E36#</Code>
  <Code Byte="16#D7#">16#0E37#</Code>
  <Code Byte="16#D8#">16#0E38#</Code>
  <Code Byte="16#D9#">16#0E39#</Code>
  <Code Byte="16#DA#">16#0E3A#</Code>
  <Code Byte="16#DF#">16#0E3F#</Code>
  <Code Byte="16#E0#">16#0E40#</Code>
  <Code Byte="16#E1#">16#0E41#</Code>
  <Code Byte="16#E2#">16#0E42#</Code>
  <Code Byte="16#E3#">16#0E43#</Code>
  <Code Byte="16#E4#">16#0E44#</Code>
  <Code Byte="16#E5#">16#0E45#</Code>
  <Code Byte="16#E6#">16#0E46#</Code>
  <Code Byte="16#E7#">16#0E47#</Code>
  <Code Byte="16#E8#">16#0E48#</Code>
  <Code Byte="16#E9#">16#0E49#</Code>
  <Code Byte="16#EA#">16#0E4A#</Code>
  <Code Byte="16#EB#">16#0E4B#</Code>
  <Code Byte="16#EC#">16#0E4C#</Code>
  <Code Byte="16#ED#">16#0E4D#</Code>
  <Code Byte="16#EE#">16#0E4E#</Code>
  <Code Byte="16#EF#">16#0E4F#</Code>
  <Code Byte="16#F0#">16#0E50#</Code>
  <Code Byte="16#F1#">16#0E51#</Code>
  <Code Byte="16#F2#">16#0E52#</Code>
  <Code Byte="16#F3#">16#0E53#</Code>
  <Code Byte="16#F4#">16#0E54#</Code>
  <Code Byte="16#F5#">16#0E55#</Code>
  <Code Byte="16#F6#">16#0E56#</Code>
  <Code Byte="16#F7#">16#0E57#</Code>
  <Code Byte="16#F8#">16#0E58#</Code>
  <Code Byte="16#F9#">16#0E59#</Code>
  <Code Byte="16#FA#">16#0E5A#</Code>
  <Code Byte="16#FB#">16#0E5B#</Code>
</Map>

