<?xml version="1.0" encoding="UTF-8"?>
<!DOCTYPE Map SYSTEM "Byte2unicode.dtd">
<Map>
  <Code Byte="16#A1#">16#1E02#</Code>
  <Code Byte="16#A2#">16#1E03#</Code>
  <Code Byte="16#A4#">16#010A#</Code>
  <Code Byte="16#A5#">16#010B#</Code>
  <Code Byte="16#A6#">16#1E0A#</Code>
  <Code Byte="16#A8#">16#1E80#</Code>
  <Code Byte="16#AA#">16#1E82#</Code>
  <Code Byte="16#AB#">16#1E0B#</Code>
  <Code Byte="16#AC#">16#1EF2#</Code>
  <Code Byte="16#AF#">16#0178#</Code>
  <Code Byte="16#B0#">16#1E1E#</Code>
  <Code Byte="16#B1#">16#1E1F#</Code>
  <Code Byte="16#B2#">16#0120#</Code>
  <Code Byte="16#B3#">16#0121#</Code>
  <Code Byte="16#B4#">16#1E40#</Code>
  <Code Byte="16#B5#">16#1E41#</Code>
  <Code Byte="16#B7#">16#1E56#</Code>
  <Code Byte="16#B8#">16#1E81#</Code>
  <Code Byte="16#B9#">16#1E57#</Code>
  <Code Byte="16#BA#">16#1E83#</Code>
  <Code Byte="16#BB#">16#1E60#</Code>
  <Code Byte="16#BC#">16#1EF3#</Code>
  <Code Byte="16#BD#">16#1E84#</Code>
  <Code Byte="16#BE#">16#1E85#</Code>
  <Code Byte="16#BF#">16#1E61#</Code>
  <Code Byte="16#D0#">16#0174#</Code>
  <Code Byte="16#D7#">16#1E6A#</Code>
  <Code Byte="16#DE#">16#0176#</Code>
  <Code Byte="16#F0#">16#0175#</Code>
  <Code Byte="16#F7#">16#1E6B#</Code>
  <Code Byte="16#FE#">16#0177#</Code>
</Map>

