<?xml version="1.0" encoding="UTF-8"?>
<!DOCTYPE Map SYSTEM "Byte2unicode.dtd">
<Map>
  <Code Byte="16#A1#">16#0104#</Code>
  <Code Byte="16#A2#">16#02D8#</Code>
  <Code Byte="16#A3#">16#0141#</Code>
  <Code Byte="16#A5#">16#013D#</Code>
  <Code Byte="16#A6#">16#015A#</Code>
  <Code Byte="16#A9#">16#0160#</Code>
  <Code Byte="16#AA#">16#015E#</Code>
  <Code Byte="16#AB#">16#0164#</Code>
  <Code Byte="16#AC#">16#0179#</Code>
  <Code Byte="16#AE#">16#017D#</Code>
  <Code Byte="16#AF#">16#017B#</Code>
  <Code Byte="16#B1#">16#0105#</Code>
  <Code Byte="16#B2#">16#02DB#</Code>
  <Code Byte="16#B3#">16#0142#</Code>
  <Code Byte="16#B5#">16#013E#</Code>
  <Code Byte="16#B6#">16#015B#</Code>
  <Code Byte="16#B7#">16#02C7#</Code>
  <Code Byte="16#B9#">16#0161#</Code>
  <Code Byte="16#BA#">16#015F#</Code>
  <Code Byte="16#BB#">16#0165#</Code>
  <Code Byte="16#BC#">16#017A#</Code>
  <Code Byte="16#BD#">16#02DD#</Code>
  <Code Byte="16#BE#">16#017E#</Code>
  <Code Byte="16#BF#">16#017C#</Code>
  <Code Byte="16#C0#">16#0154#</Code>
  <Code Byte="16#C3#">16#0102#</Code>
  <Code Byte="16#C5#">16#0139#</Code>
  <Code Byte="16#C6#">16#0106#</Code>
  <Code Byte="16#C8#">16#010C#</Code>
  <Code Byte="16#CA#">16#0118#</Code>
  <Code Byte="16#CC#">16#011A#</Code>
  <Code Byte="16#CF#">16#010E#</Code>
  <Code Byte="16#D0#">16#0110#</Code>
  <Code Byte="16#D1#">16#0143#</Code>
  <Code Byte="16#D2#">16#0147#</Code>
  <Code Byte="16#D5#">16#0150#</Code>
  <Code Byte="16#D8#">16#0158#</Code>
  <Code Byte="16#D9#">16#016E#</Code>
  <Code Byte="16#DB#">16#0170#</Code>
  <Code Byte="16#DE#">16#0162#</Code>
  <Code Byte="16#E0#">16#0155#</Code>
  <Code Byte="16#E3#">16#0103#</Code>
  <Code Byte="16#E5#">16#013A#</Code>
  <Code Byte="16#E6#">16#0107#</Code>
  <Code Byte="16#E8#">16#010D#</Code>
  <Code Byte="16#EA#">16#0119#</Code>
  <Code Byte="16#EC#">16#011B#</Code>
  <Code Byte="16#EF#">16#010F#</Code>
  <Code Byte="16#F0#">16#0111#</Code>
  <Code Byte="16#F1#">16#0144#</Code>
  <Code Byte="16#F2#">16#0148#</Code>
  <Code Byte="16#F5#">16#0151#</Code>
  <Code Byte="16#F8#">16#0159#</Code>
  <Code Byte="16#F9#">16#016F#</Code>
  <Code Byte="16#FB#">16#0171#</Code>
  <Code Byte="16#FE#">16#0163#</Code>
  <Code Byte="16#FF#">16#02D9#</Code>
</Map>

