<?xml version="1.0" encoding="UTF-8"?>
<!DOCTYPE Map SYSTEM "Byte2unicode.dtd">
<Map>
  <Code Byte="16#A4#">16#20AC#</Code>
  <Code Byte="16#A6#">16#0160#</Code>
  <Code Byte="16#A8#">16#0161#</Code>
  <Code Byte="16#B4#">16#017D#</Code>
  <Code Byte="16#B8#">16#017E#</Code>
  <Code Byte="16#BC#">16#0152#</Code>
  <Code Byte="16#BD#">16#0153#</Code>
  <Code Byte="16#BE#">16#0178#</Code>
</Map>

