<?xml version="1.0" encoding="UTF-8"?>
<!DOCTYPE Map SYSTEM "Byte2unicode.dtd">
<Map>
  <Code Byte="16#A1#">16#0104#</Code>
  <Code Byte="16#A2#">16#0138#</Code>
  <Code Byte="16#A3#">16#0156#</Code>
  <Code Byte="16#A5#">16#0128#</Code>
  <Code Byte="16#A6#">16#013B#</Code>
  <Code Byte="16#A9#">16#0160#</Code>
  <Code Byte="16#AA#">16#0112#</Code>
  <Code Byte="16#AB#">16#0122#</Code>
  <Code Byte="16#AC#">16#0166#</Code>
  <Code Byte="16#AE#">16#017D#</Code>
  <Code Byte="16#B1#">16#0105#</Code>
  <Code Byte="16#B2#">16#02DB#</Code>
  <Code Byte="16#B3#">16#0157#</Code>
  <Code Byte="16#B5#">16#0129#</Code>
  <Code Byte="16#B6#">16#013C#</Code>
  <Code Byte="16#B7#">16#02C7#</Code>
  <Code Byte="16#B9#">16#0161#</Code>
  <Code Byte="16#BA#">16#0113#</Code>
  <Code Byte="16#BB#">16#0123#</Code>
  <Code Byte="16#BC#">16#0167#</Code>
  <Code Byte="16#BD#">16#014A#</Code>
  <Code Byte="16#BE#">16#017E#</Code>
  <Code Byte="16#BF#">16#014B#</Code>
  <Code Byte="16#C0#">16#0100#</Code>
  <Code Byte="16#C7#">16#012E#</Code>
  <Code Byte="16#C8#">16#010C#</Code>
  <Code Byte="16#CA#">16#0118#</Code>
  <Code Byte="16#CC#">16#0116#</Code>
  <Code Byte="16#CF#">16#012A#</Code>
  <Code Byte="16#D0#">16#0110#</Code>
  <Code Byte="16#D1#">16#0145#</Code>
  <Code Byte="16#D2#">16#014C#</Code>
  <Code Byte="16#D3#">16#0136#</Code>
  <Code Byte="16#D9#">16#0172#</Code>
  <Code Byte="16#DD#">16#0168#</Code>
  <Code Byte="16#DE#">16#016A#</Code>
  <Code Byte="16#E0#">16#0101#</Code>
  <Code Byte="16#E7#">16#012F#</Code>
  <Code Byte="16#E8#">16#010D#</Code>
  <Code Byte="16#EA#">16#0119#</Code>
  <Code Byte="16#EC#">16#0117#</Code>
  <Code Byte="16#EF#">16#012B#</Code>
  <Code Byte="16#F0#">16#0111#</Code>
  <Code Byte="16#F1#">16#0146#</Code>
  <Code Byte="16#F2#">16#014D#</Code>
  <Code Byte="16#F3#">16#0137#</Code>
  <Code Byte="16#F9#">16#0173#</Code>
  <Code Byte="16#FD#">16#0169#</Code>
  <Code Byte="16#FE#">16#016B#</Code>
  <Code Byte="16#FF#">16#02D9#</Code>
</Map>

