<?xml version="1.0" encoding="UTF-8"?>
<!DOCTYPE Map SYSTEM "Byte2unicode.dtd">
<Map>
  <Code Byte="16#AC#">16#060C#</Code>
  <Code Byte="16#BB#">16#061B#</Code>
  <Code Byte="16#BF#">16#061F#</Code>
  <Code Byte="16#C1#">16#0621#</Code>
  <Code Byte="16#C2#">16#0622#</Code>
  <Code Byte="16#C3#">16#0623#</Code>
  <Code Byte="16#C4#">16#0624#</Code>
  <Code Byte="16#C5#">16#0625#</Code>
  <Code Byte="16#C6#">16#0626#</Code>
  <Code Byte="16#C7#">16#0627#</Code>
  <Code Byte="16#C8#">16#0628#</Code>
  <Code Byte="16#C9#">16#0629#</Code>
  <Code Byte="16#CA#">16#062A#</Code>
  <Code Byte="16#CB#">16#062B#</Code>
  <Code Byte="16#CC#">16#062C#</Code>
  <Code Byte="16#CD#">16#062D#</Code>
  <Code Byte="16#CE#">16#062E#</Code>
  <Code Byte="16#CF#">16#062F#</Code>
  <Code Byte="16#D0#">16#0630#</Code>
  <Code Byte="16#D1#">16#0631#</Code>
  <Code Byte="16#D2#">16#0632#</Code>
  <Code Byte="16#D3#">16#0633#</Code>
  <Code Byte="16#D4#">16#0634#</Code>
  <Code Byte="16#D5#">16#0635#</Code>
  <Code Byte="16#D6#">16#0636#</Code>
  <Code Byte="16#D7#">16#0637#</Code>
  <Code Byte="16#D8#">16#0638#</Code>
  <Code Byte="16#D9#">16#0639#</Code>
  <Code Byte="16#DA#">16#063A#</Code>
  <Code Byte="16#E0#">16#0640#</Code>
  <Code Byte="16#E1#">16#0641#</Code>
  <Code Byte="16#E2#">16#0642#</Code>
  <Code Byte="16#E3#">16#0643#</Code>
  <Code Byte="16#E4#">16#0644#</Code>
  <Code Byte="16#E5#">16#0645#</Code>
  <Code Byte="16#E6#">16#0646#</Code>
  <Code Byte="16#E7#">16#0647#</Code>
  <Code Byte="16#E8#">16#0648#</Code>
  <Code Byte="16#E9#">16#0649#</Code>
  <Code Byte="16#EA#">16#064A#</Code>
  <Code Byte="16#EB#">16#064B#</Code>
  <Code Byte="16#EC#">16#064C#</Code>
  <Code Byte="16#ED#">16#064D#</Code>
  <Code Byte="16#EE#">16#064E#</Code>
  <Code Byte="16#EF#">16#064F#</Code>
  <Code Byte="16#F0#">16#0650#</Code>
  <Code Byte="16#F1#">16#0651#</Code>
  <Code Byte="16#F2#">16#0652#</Code>
</Map>

